{
  "artifact_relative_root": "pipelines/brisbane_baylands/task_04d_relinked_v1/document_publications",
  "document_processes": [
    {
      "configs": {
        "content_parsing": "configs/task03h/v4/deir_appendix_k4/content_parsing.json",
        "document_reference_linking": "configs/task03h/v4/deir_appendix_k4/document_reference_linking.json",
        "document_structure": "configs/task03h/v4/deir_appendix_k4/document_structure.json",
        "heading_evidence_parsing": "configs/task03h/v4/deir_appendix_k4/heading_evidence_parsing.json",
        "hierarchy_inference": "configs/task03h/v4/deir_appendix_k4/hierarchy_inference.json",
        "record_mapping": "configs/task03h/v4/deir_appendix_k4/record_mapping.json"
      },
      "lineage_mode": "fresh_build",
      "source_id": "deir_appendix_k4"
    },
    {
      "configs": {
        "content_parsing": "configs/task03h/v4/deir_appendix_n1/content_parsing.json",
        "document_reference_linking": "configs/task03h/v4/deir_appendix_n1/document_reference_linking.json",
        "document_structure": "configs/task03h/v4/deir_appendix_n1/document_structure.json",
        "heading_evidence_parsing": "configs/task03h/v4/deir_appendix_n1/heading_evidence_parsing.json",
        "hierarchy_inference": "configs/task03h/v4/deir_appendix_n1/hierarchy_inference.json",
        "record_mapping": "configs/task03h/v4/deir_appendix_n1/record_mapping.json"
      },
      "lineage_mode": "fresh_build",
      "source_id": "deir_appendix_n1"
    },
    {
      "configs": {
        "content_parsing": "configs/task03h/v4/deir_appendix_k5/content_parsing.json",
        "document_reference_linking": "configs/task03h/v4/deir_appendix_k5/document_reference_linking.json",
        "document_structure": "configs/task03h/v4/deir_appendix_k5/document_structure.json",
        "heading_evidence_parsing": "configs/task03h/v4/deir_appendix_k5/heading_evidence_parsing.json",
        "hierarchy_inference": "configs/task03h/v4/deir_appendix_k5/hierarchy_inference.json",
        "record_mapping": "configs/task03h/v4/deir_appendix_k5/record_mapping.json"
      },
      "lineage_mode": "fresh_build",
      "source_id": "deir_appendix_k5"
    },
    {
      "configs": {
        "content_parsing": "configs/task03h/v4/deir_appendix_n2/content_parsing.json",
        "document_reference_linking": "configs/task03h/v4/deir_appendix_n2/document_reference_linking.json",
        "document_structure": "configs/task03h/v4/deir_appendix_n2/document_structure.json",
        "heading_evidence_parsing": "configs/task03h/v4/deir_appendix_n2/heading_evidence_parsing.json",
        "hierarchy_inference": "configs/task03h/v4/deir_appendix_n2/hierarchy_inference.json",
        "record_mapping": "configs/task03h/v4/deir_appendix_n2/record_mapping.json"
      },
      "lineage_mode": "fresh_build",
      "source_id": "deir_appendix_n2"
    },
    {
      "configs": {
        "content_parsing": "configs/task03h/v4/deir_appendix_f2/content_parsing.json",
        "document_reference_linking": "configs/task03h/v4/deir_appendix_f2/document_reference_linking.json",
        "document_structure": "configs/task03h/v4/deir_appendix_f2/document_structure.json",
        "heading_evidence_parsing": "configs/task03h/v4/deir_appendix_f2/heading_evidence_parsing.json",
        "hierarchy_inference": "configs/task03h/v4/deir_appendix_f2/hierarchy_inference.json",
        "record_mapping": "configs/task03h/v4/deir_appendix_f2/record_mapping.json"
      },
      "lineage_mode": "fresh_build",
      "source_id": "deir_appendix_f2"
    },
    {
      "configs": {
        "content_parsing": "configs/task03h/v4/deir_appendix_k6/content_parsing.json",
        "document_reference_linking": "configs/task03h/v4/deir_appendix_k6/document_reference_linking.json",
        "document_structure": "configs/task03h/v4/deir_appendix_k6/document_structure.json",
        "heading_evidence_parsing": "configs/task03h/v4/deir_appendix_k6/heading_evidence_parsing.json",
        "hierarchy_inference": "configs/task03h/v4/deir_appendix_k6/hierarchy_inference.json",
        "record_mapping": "configs/task03h/v4/deir_appendix_k6/record_mapping.json"
      },
      "lineage_mode": "fresh_build",
      "source_id": "deir_appendix_k6"
    },
    {
      "configs": {
        "content_parsing": "configs/task03h/v4/deir_appendix_m3/content_parsing.json",
        "document_reference_linking": "configs/task03h/v4/deir_appendix_m3/document_reference_linking.json",
        "document_structure": "configs/task03h/v4/deir_appendix_m3/document_structure.json",
        "heading_evidence_parsing": "configs/task03h/v4/deir_appendix_m3/heading_evidence_parsing.json",
        "hierarchy_inference": "configs/task03h/v4/deir_appendix_m3/hierarchy_inference.json",
        "record_mapping": "configs/task03h/v4/deir_appendix_m3/record_mapping.json"
      },
      "lineage_mode": "fresh_build",
      "source_id": "deir_appendix_m3"
    },
    {
      "configs": {
        "content_parsing": "configs/task03h/v4/deir_appendix_l/content_parsing.json",
        "document_reference_linking": "configs/task03h/v4/deir_appendix_l/document_reference_linking.json",
        "document_structure": "configs/task03h/v4/deir_appendix_l/document_structure.json",
        "heading_evidence_parsing": "configs/task03h/v4/deir_appendix_l/heading_evidence_parsing.json",
        "hierarchy_inference": "configs/task03h/v4/deir_appendix_l/hierarchy_inference.json",
        "record_mapping": "configs/task03h/v4/deir_appendix_l/record_mapping.json"
      },
      "lineage_mode": "fresh_build",
      "source_id": "deir_appendix_l"
    },
    {
      "configs": {
        "content_parsing": "configs/task03h/v4/deir_appendix_o/content_parsing.json",
        "document_reference_linking": "configs/task03h/v4/deir_appendix_o/document_reference_linking.json",
        "document_structure": "configs/task03h/v4/deir_appendix_o/document_structure.json",
        "heading_evidence_parsing": "configs/task03h/v4/deir_appendix_o/heading_evidence_parsing.json",
        "hierarchy_inference": "configs/task03h/v4/deir_appendix_o/hierarchy_inference.json",
        "record_mapping": "configs/task03h/v4/deir_appendix_o/record_mapping.json"
      },
      "lineage_mode": "fresh_build",
      "source_id": "deir_appendix_o"
    },
    {
      "configs": {
        "content_parsing": "configs/task03h/v4/deir_appendix_f1/content_parsing.json",
        "document_reference_linking": "configs/task03h/v4/deir_appendix_f1/document_reference_linking.json",
        "document_structure": "configs/task03h/v4/deir_appendix_f1/document_structure.json",
        "heading_evidence_parsing": "configs/task03h/v4/deir_appendix_f1/heading_evidence_parsing.json",
        "hierarchy_inference": "configs/task03h/v4/deir_appendix_f1/hierarchy_inference.json",
        "record_mapping": "configs/task03h/v4/deir_appendix_f1/record_mapping.json"
      },
      "lineage_mode": "fresh_build",
      "source_id": "deir_appendix_f1"
    },
    {
      "configs": {
        "content_parsing": "configs/task03h/v4/deir_appendix_c/content_parsing.json",
        "document_reference_linking": "configs/task03h/v4/deir_appendix_c/document_reference_linking.json",
        "document_structure": "configs/task03h/v4/deir_appendix_c/document_structure.json",
        "heading_evidence_parsing": "configs/task03h/v4/deir_appendix_c/heading_evidence_parsing.json",
        "hierarchy_inference": "configs/task03h/v4/deir_appendix_c/hierarchy_inference.json",
        "record_mapping": "configs/task03h/v4/deir_appendix_c/record_mapping.json"
      },
      "lineage_mode": "fresh_build",
      "source_id": "deir_appendix_c"
    },
    {
      "configs": {
        "content_parsing": "configs/task03h/v4/deir_appendix_j/content_parsing.json",
        "document_reference_linking": "configs/task03h/v4/deir_appendix_j/document_reference_linking.json",
        "document_structure": "configs/task03h/v4/deir_appendix_j/document_structure.json",
        "heading_evidence_parsing": "configs/task03h/v4/deir_appendix_j/heading_evidence_parsing.json",
        "hierarchy_inference": "configs/task03h/v4/deir_appendix_j/hierarchy_inference.json",
        "record_mapping": "configs/task03h/v4/deir_appendix_j/record_mapping.json"
      },
      "lineage_mode": "fresh_build",
      "source_id": "deir_appendix_j"
    },
    {
      "configs": {
        "content_parsing": "configs/task03h/v4/deir_appendix_p/content_parsing.json",
        "document_reference_linking": "configs/task03h/v4/deir_appendix_p/document_reference_linking.json",
        "document_structure": "configs/task03h/v4/deir_appendix_p/document_structure.json",
        "heading_evidence_parsing": "configs/task03h/v4/deir_appendix_p/heading_evidence_parsing.json",
        "hierarchy_inference": "configs/task03h/v4/deir_appendix_p/hierarchy_inference.json",
        "record_mapping": "configs/task03h/v4/deir_appendix_p/record_mapping.json"
      },
      "lineage_mode": "fresh_build",
      "source_id": "deir_appendix_p"
    },
    {
      "configs": {
        "content_parsing": "configs/task03h/v4/deir_appendix_m1/content_parsing.json",
        "document_reference_linking": "configs/task03h/v4/deir_appendix_m1/document_reference_linking.json",
        "document_structure": "configs/task03h/v4/deir_appendix_m1/document_structure.json",
        "heading_evidence_parsing": "configs/task03h/v4/deir_appendix_m1/heading_evidence_parsing.json",
        "hierarchy_inference": "configs/task03h/v4/deir_appendix_m1/hierarchy_inference.json",
        "record_mapping": "configs/task03h/v4/deir_appendix_m1/record_mapping.json"
      },
      "lineage_mode": "fresh_build",
      "source_id": "deir_appendix_m1"
    },
    {
      "configs": {
        "content_parsing": "configs/task03h/v4/deir_appendix_b/content_parsing.json",
        "document_reference_linking": "configs/task03h/v4/deir_appendix_b/document_reference_linking.json",